{
  "contract_version": "scheduler.recovery-plan.v1",
  "recovery_plan_id": "FIXTURE-PLAN-002",
  "incident_id": "FIXTURE-INCIDENT-001",
  "world_id": "PRIMARY",
  "source_snapshot": {
    "snapshot_revision": "twin-rev-184202",
    "generated_at": "2026-10-27T08:00:00Z"
  },
  "base_schedule_version": "schedule-v19",
  "generated_at": "2026-10-27T08:01:00Z",
  "valid_until": "2026-10-27T08:05:00Z",
  "generation": {
    "kind": "DEVELOPMENT_FIXTURE",
    "generator_id": "development-fixture",
    "generator_version": "1"
  },
  "affected_material": [
    {
      "lot_id": "LOT-001",
      "lot_revision": "lot-rev-11",
      "route_id": "ROUTE-A",
      "visit_id": "VISIT-A-03",
      "position": 2
    },
    {
      "lot_id": "LOT-002",
      "lot_revision": "lot-rev-4",
      "route_id": "ROUTE-B",
      "visit_id": "VISIT-B-01",
      "position": 0
    }
  ],
  "affected_equipment": [
    {
      "equipment_id": "CNC-5AX-07",
      "equipment_revision": "equipment-rev-7"
    }
  ],
  "assumptions": [
    {
      "assumption_id": "ASSUMP-1",
      "statement": "Development fixture: assignment intervals are illustrative and are not derived from any processing-time source."
    }
  ],
  "objective_profile": {
    "profile_id": "FIXTURE-PROFILE",
    "profile_version": "1",
    "method": "WEIGHTED_SUM",
    "terms": [
      {
        "metric": "total_tardiness",
        "unit": "minute",
        "direction": "MINIMIZE",
        "weight": 1.0
      },
      {
        "metric": "moved_assignments",
        "unit": "count",
        "direction": "MINIMIZE",
        "weight": 1.0
      }
    ]
  },
  "candidate_schedules": [
    {
      "candidate_id": "FIXTURE-CAND-A",
      "algorithm": {
        "algorithm_id": "development-fixture",
        "algorithm_version": "1"
      },
      "horizon": {
        "start_at": "2026-10-27T08:05:00Z",
        "end_at": "2026-10-27T20:05:00Z"
      },
      "assignments": [
        {
          "assignment_id": "A-1",
          "lot_id": "LOT-001",
          "lot_revision": "lot-rev-11",
          "route_id": "ROUTE-A",
          "visit_id": "VISIT-A-03",
          "equipment_id": "CNC-5AX-07",
          "equipment_revision": "equipment-rev-7",
          "start_at": "2026-10-27T08:05:00Z",
          "end_at": "2026-10-27T09:05:00Z",
          "batch_id": null
        },
        {
          "assignment_id": "A-2",
          "lot_id": "LOT-002",
          "lot_revision": "lot-rev-4",
          "route_id": "ROUTE-B",
          "visit_id": "VISIT-B-01",
          "equipment_id": "CNC-5AX-07",
          "equipment_revision": "equipment-rev-7",
          "start_at": "2026-10-27T09:05:00Z",
          "end_at": "2026-10-27T11:05:00Z",
          "batch_id": null
        }
      ],
      "solve": {
        "status": "FEASIBLE",
        "wall_time_ms": 12.5
      },
      "predicted_objectives": [
        {
          "metric": "total_tardiness",
          "unit": "minute",
          "status": "COMPUTED",
          "value": 0.0
        },
        {
          "metric": "moved_assignments",
          "unit": "count",
          "status": "COMPUTED",
          "value": 0
        }
      ],
      "stability": {
        "status": "COMPUTED",
        "moved_assignment_count": 0
      },
      "counterfactual": {
        "status": "AVAILABLE",
        "result_ref": "FIXTURE-CF-A",
        "counterfactual_world_id": "FIXTURE-COUNTERFACTUAL-WORLD"
      },
      "validation_result": {
        "status": "REPORTED_VALID",
        "validator": {
          "validator_id": "FIXTURE-NOT-A-VALIDATOR",
          "validator_version": "0"
        },
        "result_ref": "FIXTURE-VALIDATION-A",
        "violation_refs": [],
        "bound_to": {
          "world_id": "PRIMARY",
          "snapshot_revision": "twin-rev-184202",
          "candidate_id": "FIXTURE-CAND-A"
        }
      }
    },
    {
      "candidate_id": "FIXTURE-CAND-B",
      "algorithm": {
        "algorithm_id": "development-fixture",
        "algorithm_version": "1"
      },
      "horizon": {
        "start_at": "2026-10-27T08:05:00Z",
        "end_at": "2026-10-27T20:05:00Z"
      },
      "assignments": [
        {
          "assignment_id": "B-1",
          "lot_id": "LOT-001",
          "lot_revision": "lot-rev-11",
          "route_id": "ROUTE-A",
          "visit_id": "VISIT-A-03",
          "equipment_id": "CNC-5AX-07",
          "equipment_revision": "equipment-rev-7",
          "start_at": "2026-10-27T08:05:00Z",
          "end_at": "2026-10-27T09:05:00Z",
          "batch_id": null
        },
        {
          "assignment_id": "B-2",
          "lot_id": "LOT-002",
          "lot_revision": "lot-rev-4",
          "route_id": "ROUTE-B",
          "visit_id": "VISIT-B-01",
          "equipment_id": "CNC-5AX-08",
          "equipment_revision": "equipment-rev-3",
          "start_at": "2026-10-27T08:05:00Z",
          "end_at": "2026-10-27T10:05:00Z",
          "batch_id": null
        }
      ],
      "solve": {
        "status": "FEASIBLE",
        "wall_time_ms": 12.5
      },
      "predicted_objectives": [
        {
          "metric": "total_tardiness",
          "unit": "minute",
          "status": "COMPUTED",
          "value": 0.0
        },
        {
          "metric": "moved_assignments",
          "unit": "count",
          "status": "COMPUTED",
          "value": 1
        }
      ],
      "stability": {
        "status": "COMPUTED",
        "moved_assignment_count": 1
      },
      "counterfactual": {
        "status": "AVAILABLE",
        "result_ref": "FIXTURE-CF-B",
        "counterfactual_world_id": "FIXTURE-COUNTERFACTUAL-WORLD"
      },
      "validation_result": {
        "status": "REPORTED_VALID",
        "validator": {
          "validator_id": "FIXTURE-NOT-A-VALIDATOR",
          "validator_version": "0"
        },
        "result_ref": "FIXTURE-VALIDATION-B",
        "violation_refs": [],
        "bound_to": {
          "world_id": "PRIMARY",
          "snapshot_revision": "twin-rev-184202",
          "candidate_id": "FIXTURE-CAND-B"
        }
      }
    }
  ],
  "recommended_candidate_id": "FIXTURE-CAND-A",
  "comparison": {
    "status": "COMPUTED",
    "ranking": [
      "FIXTURE-CAND-A",
      "FIXTURE-CAND-B"
    ]
  },
  "rationale": {
    "status": "TRACE_DERIVED",
    "summary": "Development fixture claim: candidate A moves nothing.",
    "trace_refs": [
      "FIXTURE-TRACE-1"
    ]
  },
  "content_digest": "sha256:c7fd69e8333da7a05f2c682cb8b19e3d6520bfdbe1b8114edad651347d3b4311"
}
